{
  "schema_version": "2",
  "record_type": "platform_authority_lambda_invocation_allowlist",
  "environment": "non-production",
  "production": false,
  "authorization_mode": "SINGLE_OPERATOR_NONPROD_EXCEPTION",
  "two_human_status": "NOT_PROVEN",
  "independent_approval_present": false,
  "single_operator_exception_digest": "sha256:d336bed30a82ce48e261b9b5465fc528b37c8b307a32e270313e33d14045175b",
  "owner_authorization_sha256": "sha256:5438bffceacd77712bde422e6d98274ec5f87285fdf2a0bbaf0d63c75da30300",
  "active_aliases": [
    "single-classify",
    "single-reconcile",
    "single-retire"
  ],
  "inventory_scope": "ALL_ENABLED_REGIONS_AND_GLOBAL_IAM",
  "authority_account_id_digest": "sha256:aaaaaaaaaaaaaaaaaaaaaaaaaaaaaaaaaaaaaaaaaaaaaaaaaaaaaaaaaaaaaaaa",
  "target_region": "us-east-1",
  "source_template_sha256": "sha256:bbbbbbbbbbbbbbbbbbbbbbbbbbbbbbbbbbbbbbbbbbbbbbbbbbbbbbbbbbbbbbbb",
  "source_policy_bundle_sha256": "sha256:cccccccccccccccccccccccccccccccccccccccccccccccccccccccccccccccc",
  "broker_artifact_code_sha256": "47DEQpj8HBSa+/TImW+5JCeuQeRkm5NMpJWZG3hSuFU=",
  "broker_published_configuration_sha256": "sha256:4ef759319a9a451905c775748e514f6ea0e018aae7eb359bea12f9c98fbc289c",
  "collector_role_principal_digest": "sha256:ffffffffffffffffffffffffffffffffffffffffffffffffffffffffffffffff",
  "expected_authority_edges": [
    {
      "authority_class": "INVOCATION",
      "source_type": "LAMBDA_RESOURCE_POLICY",
      "duty": "single_operator_classifier",
      "target_scope": "EXACT_SINGLE_CLASSIFY_ALIAS",
      "action": "lambda:InvokeFunctionUrl",
      "condition_class": "FUNCTION_URL_AUTH_TYPE_AWS_IAM",
      "principal_digest": "sha256:5555555555555555555555555555555555555555555555555555555555555555",
      "resource_digest": "sha256:9999999999999999999999999999999999999999999999999999999999999999",
      "source_document_digest": "sha256:dddddddddddddddddddddddddddddddddddddddddddddddddddddddddddddddd"
    },
    {
      "authority_class": "INVOCATION",
      "source_type": "LAMBDA_RESOURCE_POLICY",
      "duty": "single_operator_classifier",
      "target_scope": "EXACT_SINGLE_CLASSIFY_ALIAS",
      "action": "lambda:InvokeFunction",
      "condition_class": "INVOKED_VIA_FUNCTION_URL_TRUE",
      "principal_digest": "sha256:5555555555555555555555555555555555555555555555555555555555555555",
      "resource_digest": "sha256:9999999999999999999999999999999999999999999999999999999999999999",
      "source_document_digest": "sha256:dddddddddddddddddddddddddddddddddddddddddddddddddddddddddddddddd"
    },
    {
      "authority_class": "INVOCATION",
      "source_type": "LAMBDA_RESOURCE_POLICY",
      "duty": "single_operator_retirement",
      "target_scope": "EXACT_SINGLE_RETIRE_ALIAS",
      "action": "lambda:InvokeFunctionUrl",
      "condition_class": "FUNCTION_URL_AUTH_TYPE_AWS_IAM",
      "principal_digest": "sha256:6666666666666666666666666666666666666666666666666666666666666666",
      "resource_digest": "sha256:aaaaaaaaaaaaaaaaaaaaaaaaaaaaaaaaaaaaaaaaaaaaaaaaaaaaaaaaaaaaaaaa",
      "source_document_digest": "sha256:eeeeeeeeeeeeeeeeeeeeeeeeeeeeeeeeeeeeeeeeeeeeeeeeeeeeeeeeeeeeeeee"
    },
    {
      "authority_class": "INVOCATION",
      "source_type": "LAMBDA_RESOURCE_POLICY",
      "duty": "single_operator_retirement",
      "target_scope": "EXACT_SINGLE_RETIRE_ALIAS",
      "action": "lambda:InvokeFunction",
      "condition_class": "INVOKED_VIA_FUNCTION_URL_TRUE",
      "principal_digest": "sha256:6666666666666666666666666666666666666666666666666666666666666666",
      "resource_digest": "sha256:aaaaaaaaaaaaaaaaaaaaaaaaaaaaaaaaaaaaaaaaaaaaaaaaaaaaaaaaaaaaaaaa",
      "source_document_digest": "sha256:eeeeeeeeeeeeeeeeeeeeeeeeeeeeeeeeeeeeeeeeeeeeeeeeeeeeeeeeeeeeeeee"
    },
    {
      "authority_class": "INVOCATION",
      "source_type": "LAMBDA_RESOURCE_POLICY",
      "duty": "single_operator_retirement",
      "target_scope": "EXACT_SINGLE_RECONCILE_ALIAS",
      "action": "lambda:InvokeFunctionUrl",
      "condition_class": "FUNCTION_URL_AUTH_TYPE_AWS_IAM",
      "principal_digest": "sha256:6666666666666666666666666666666666666666666666666666666666666666",
      "resource_digest": "sha256:bbbbbbbbbbbbbbbbbbbbbbbbbbbbbbbbbbbbbbbbbbbbbbbbbbbbbbbbbbbbbbbb",
      "source_document_digest": "sha256:ffffffffffffffffffffffffffffffffffffffffffffffffffffffffffffffff"
    },
    {
      "authority_class": "INVOCATION",
      "source_type": "LAMBDA_RESOURCE_POLICY",
      "duty": "single_operator_retirement",
      "target_scope": "EXACT_SINGLE_RECONCILE_ALIAS",
      "action": "lambda:InvokeFunction",
      "condition_class": "INVOKED_VIA_FUNCTION_URL_TRUE",
      "principal_digest": "sha256:6666666666666666666666666666666666666666666666666666666666666666",
      "resource_digest": "sha256:bbbbbbbbbbbbbbbbbbbbbbbbbbbbbbbbbbbbbbbbbbbbbbbbbbbbbbbbbbbbbbbb",
      "source_document_digest": "sha256:ffffffffffffffffffffffffffffffffffffffffffffffffffffffffffffffff"
    },
    {
      "authority_class": "INVOCATION",
      "source_type": "IAM_ROLE_INLINE_POLICY",
      "duty": "single_operator_classifier",
      "target_scope": "EXACT_SINGLE_CLASSIFY_ALIAS",
      "action": "lambda:InvokeFunctionUrl",
      "condition_class": "FUNCTION_URL_AUTH_TYPE_AWS_IAM",
      "principal_digest": "sha256:5555555555555555555555555555555555555555555555555555555555555555",
      "resource_digest": "sha256:9999999999999999999999999999999999999999999999999999999999999999",
      "source_document_digest": "sha256:1111111111111111111111111111111111111111111111111111111111111111"
    },
    {
      "authority_class": "INVOCATION",
      "source_type": "IAM_ROLE_INLINE_POLICY",
      "duty": "single_operator_classifier",
      "target_scope": "EXACT_SINGLE_CLASSIFY_ALIAS",
      "action": "lambda:InvokeFunction",
      "condition_class": "INVOKED_VIA_FUNCTION_URL_TRUE",
      "principal_digest": "sha256:5555555555555555555555555555555555555555555555555555555555555555",
      "resource_digest": "sha256:9999999999999999999999999999999999999999999999999999999999999999",
      "source_document_digest": "sha256:1111111111111111111111111111111111111111111111111111111111111111"
    },
    {
      "authority_class": "INVOCATION",
      "source_type": "IAM_ROLE_INLINE_POLICY",
      "duty": "single_operator_retirement",
      "target_scope": "EXACT_SINGLE_RETIRE_ALIAS",
      "action": "lambda:InvokeFunctionUrl",
      "condition_class": "FUNCTION_URL_AUTH_TYPE_AWS_IAM",
      "principal_digest": "sha256:6666666666666666666666666666666666666666666666666666666666666666",
      "resource_digest": "sha256:aaaaaaaaaaaaaaaaaaaaaaaaaaaaaaaaaaaaaaaaaaaaaaaaaaaaaaaaaaaaaaaa",
      "source_document_digest": "sha256:2222222222222222222222222222222222222222222222222222222222222222"
    },
    {
      "authority_class": "INVOCATION",
      "source_type": "IAM_ROLE_INLINE_POLICY",
      "duty": "single_operator_retirement",
      "target_scope": "EXACT_SINGLE_RETIRE_ALIAS",
      "action": "lambda:InvokeFunction",
      "condition_class": "INVOKED_VIA_FUNCTION_URL_TRUE",
      "principal_digest": "sha256:6666666666666666666666666666666666666666666666666666666666666666",
      "resource_digest": "sha256:aaaaaaaaaaaaaaaaaaaaaaaaaaaaaaaaaaaaaaaaaaaaaaaaaaaaaaaaaaaaaaaa",
      "source_document_digest": "sha256:2222222222222222222222222222222222222222222222222222222222222222"
    },
    {
      "authority_class": "INVOCATION",
      "source_type": "IAM_ROLE_INLINE_POLICY",
      "duty": "single_operator_retirement",
      "target_scope": "EXACT_SINGLE_RECONCILE_ALIAS",
      "action": "lambda:InvokeFunctionUrl",
      "condition_class": "FUNCTION_URL_AUTH_TYPE_AWS_IAM",
      "principal_digest": "sha256:6666666666666666666666666666666666666666666666666666666666666666",
      "resource_digest": "sha256:bbbbbbbbbbbbbbbbbbbbbbbbbbbbbbbbbbbbbbbbbbbbbbbbbbbbbbbbbbbbbbbb",
      "source_document_digest": "sha256:2222222222222222222222222222222222222222222222222222222222222222"
    },
    {
      "authority_class": "INVOCATION",
      "source_type": "IAM_ROLE_INLINE_POLICY",
      "duty": "single_operator_retirement",
      "target_scope": "EXACT_SINGLE_RECONCILE_ALIAS",
      "action": "lambda:InvokeFunction",
      "condition_class": "INVOKED_VIA_FUNCTION_URL_TRUE",
      "principal_digest": "sha256:6666666666666666666666666666666666666666666666666666666666666666",
      "resource_digest": "sha256:bbbbbbbbbbbbbbbbbbbbbbbbbbbbbbbbbbbbbbbbbbbbbbbbbbbbbbbbbbbbbbbb",
      "source_document_digest": "sha256:2222222222222222222222222222222222222222222222222222222222222222"
    },
    {
      "authority_class": "TRUST",
      "source_type": "IAM_ROLE_TRUST_POLICY",
      "duty": "single_operator_classifier",
      "target_scope": "CLASSIFIER_INVOKER_ROLE",
      "action": "sts:AssumeRole",
      "condition_class": "EXACT_PERMISSION_SET_TRUST",
      "principal_digest": "sha256:7777777777777777777777777777777777777777777777777777777777777777",
      "resource_digest": "sha256:5555555555555555555555555555555555555555555555555555555555555555",
      "source_document_digest": "sha256:3333333333333333333333333333333333333333333333333333333333333333"
    },
    {
      "authority_class": "TRUST",
      "source_type": "IAM_ROLE_TRUST_POLICY",
      "duty": "single_operator_retirement",
      "target_scope": "APPROVER_INVOKER_ROLE",
      "action": "sts:AssumeRole",
      "condition_class": "EXACT_PERMISSION_SET_TRUST",
      "principal_digest": "sha256:8888888888888888888888888888888888888888888888888888888888888888",
      "resource_digest": "sha256:6666666666666666666666666666666666666666666666666666666666666666",
      "source_document_digest": "sha256:4444444444444444444444444444444444444444444444444444444444444444"
    }
  ],
  "forbidden_authority_classes": [
    "PUBLIC_PRINCIPAL",
    "WILDCARD_ACTION",
    "WILDCARD_RESOURCE",
    "FUNCTION_URL_NONE",
    "UNQUALIFIED_FUNCTION",
    "LATEST_VERSION",
    "NUMERIC_VERSION",
    "ALTERNATE_ALIAS",